{
  "$schema": "http://json-schema.org/draft-07/schema#",
  "$id": "https://faultynode.github.io/commentaries/synthesis/schema/extraction.schema.json",
  "title": "Theme extraction record",
  "description": "One pass of Stage 1 over one commentary for one theme. Extraction states what a commentary says at a locatable place; it never interprets, and it never reaches past the commentary to the primary text. Every unit carries a verbatim quote so the claim can be checked mechanically.",
  "type": "object",
  "additionalProperties": false,
  "required": [
    "schema_version",
    "theme",
    "commentary",
    "source_sha256",
    "extracted_at",
    "coverage",
    "units",
    "absences"
  ],
  "properties": {
    "schema_version": { "const": 1 },
    "theme": {
      "type": "string",
      "pattern": "^[a-z0-9-]+$",
      "description": "Theme id; must exist in synthesis/themes.json."
    },
    "commentary": {
      "type": "string",
      "pattern": "^[a-z0-9-]+$",
      "description": "Commentary slug (filename stem); must exist in synthesis/corpus.json."
    },
    "source_sha256": {
      "type": "string",
      "pattern": "^[0-9a-f]{64}$",
      "description": "Digest of the commentary file this pass read. When the file's current digest differs, the record is stale and its quotes are no longer authoritative."
    },
    "extracted_at": { "type": "string", "pattern": "^[0-9]{4}-[0-9]{2}-[0-9]{2}$" },
    "extractor": {
      "type": "object",
      "additionalProperties": false,
      "required": ["agent", "prompt"],
      "properties": {
        "agent": { "type": "string" },
        "model": {
          "type": "string",
          "description": "Model identifier for the pass, as the provider names it (e.g. claude-opus-5). Optional, and never supplied from memory: a record written before this field existed omits it rather than guessing which model wrote it."
        },
        "prompt": { "type": "string" },
        "note": { "type": "string" }
      }
    },
    "coverage": {
      "type": "string",
      "enum": ["complete", "partial"],
      "description": "'complete' asserts the whole commentary was scanned. A partial pass must say what it covered in coverage_note; the status report treats it as unfinished."
    },
    "coverage_note": { "type": "string" },
    "units": { "type": "array", "items": { "$ref": "#/$defs/unit" } },
    "absences": {
      "type": "array",
      "description": "Places the theme was expected and is not present. Absences periodize; an empty array is a claim, not a default.",
      "items": { "$ref": "#/$defs/absence" }
    }
  },
  "$defs": {
    "unit": {
      "type": "object",
      "additionalProperties": false,
      "required": ["id", "locator", "term", "claim", "status", "quote"],
      "properties": {
        "id": {
          "type": "string",
          "pattern": "^[a-z0-9-]+/[a-z0-9-]+/[0-9]{3}$",
          "description": "theme/commentary-shortname/NNN. Stable across re-runs: reuse the id when re-extracting the same unit."
        },
        "locator": {
          "type": "string",
          "pattern": "^[a-z0-9-]+#[a-z0-9-]+$",
          "description": "commentary-slug#section-id, resolved against synthesis/corpus.json."
        },
        "primary_locator": {
          "type": "string",
          "description": "Citation into the primary text in that text's own system (SZ 126, GA 19 § 12, Hua IV § 18), as the commentary gives it. Never supplied from outside the commentary."
        },
        "stratum": {
          "type": "string",
          "description": "Stratum id from synthesis/chronology.json, where the commentary's own text assigns the passage to a dated layer."
        },
        "term": {
          "type": "string",
          "description": "The term as it appears at that place - German, Greek, or the commentary's fixed English rendering."
        },
        "claim": {
          "type": "string",
          "minLength": 12,
          "maxLength": 400,
          "description": "One sentence: what is claimed there. Not what it means, not what it leads to."
        },
        "status": {
          "type": "string",
          "enum": ["introduced", "presupposed", "revised", "criticized"],
          "description": "What the term is doing at that place."
        },
        "quote": {
          "type": "string",
          "minLength": 24,
          "maxLength": 400,
          "description": "Verbatim from the commentary, inside the located section. Checked by scripts/synthesis_validate.py; a quote that does not appear fails the build."
        }
      }
    },
    "absence": {
      "type": "object",
      "additionalProperties": false,
      "required": ["locator", "expected_because"],
      "properties": {
        "locator": { "type": "string", "pattern": "^[a-z0-9-]+#[a-z0-9-]+$" },
        "expected_because": {
          "type": "string",
          "minLength": 12,
          "maxLength": 400,
          "description": "Why the theme was expected here - the argument that would have called for it."
        },
        "note": { "type": "string", "maxLength": 400 },
        "absent_terms": {
          "type": "array",
          "description": "Terms checked for and not found. Defaults to the theme's search terms. The validator re-checks these against the section and fails if one is in fact present.",
          "items": { "type": "string" }
        }
      }
    }
  }
}
