{
  "schema_version": 1,
  "theme": "transzendenz",
  "commentary": "husserliana-23-phantasie-bildbewusstsein-erinnerung-commentary",
  "source_sha256": "bc6062f1f10f52f5acc267ba28642f54ccfd617525128f3b18d3661b30b5ecbb",
  "extracted_at": "2026-10-15",
  "extractor": {
    "agent": "claude-code",
    "model": "claude-opus-5-5",
    "prompt": "synthesis/prompts/extraction-prompt.md",
    "note": "Read every paragraph carrying transcend- (outside transcendental) or immanen-, in file order."
  },
  "coverage": "partial",
  "coverage_note": "Term-led pass over the whole file (lines 1-399): every paragraph containing the transcendence family, including bare transcendent and immanent, was read; paragraphs without such a word were not read.",
  "units": [
    {
      "id": "transzendenz/hua23/001",
      "locator": "husserliana-23-phantasie-bildbewusstsein-erinnerung-commentary#h3-s1-ambiguity-of-the-concept-of-phantasy-in-ordinary-discourse-the-phantasy-exper",
      "primary_locator": "Hua XXIII § 1",
      "stratum": "hua23-1904",
      "term": "immanent sphere",
      "status": "introduced",
      "claim": "Disposition objectifyingly reaches beyond the genuine immanent sphere, while phenomenologically only the immanent matters, inner characters grasped in pure adequation.",
      "quote": "Disposition, by contrast, is a concept that objectifyingly reaches beyond the genuine immanent sphere."
    },
    {
      "id": "transzendenz/hua23/002",
      "locator": "husserliana-23-phantasie-bildbewusstsein-erinnerung-commentary#h3-s10-essential-commonality-of-physical-imagination-and-ordinary-phantasy-presenta",
      "primary_locator": "Hua XXIII § 10",
      "stratum": "hua23-1904",
      "term": "really immanent",
      "status": "criticized",
      "claim": "The naive view errs in thinking of the mental image as a thing really immanent in the mind.",
      "quote": "The phenomenological response: the naive view errs in thinking of the mental image as a thing really immanent in the mind."
    },
    {
      "id": "transzendenz/hua23/003",
      "locator": "husserliana-23-phantasie-bildbewusstsein-erinnerung-commentary#h3-s16-introduction-of-the-distinction-between-inner-immanent-and-outer-symbolic-im",
      "primary_locator": "Hua XXIII § 16",
      "stratum": "hua23-1904",
      "term": "immanent imagehood",
      "status": "introduced",
      "claim": "An image can function representatively inwardly, as immanent imagehood, or outwardly, as symbolic representation.",
      "quote": "An image can function representatively inwardly, in the manner of immanent imagehood; or it can function representatively outwardly, in a manner that essentially amounts to the consciousness of symbolic representation."
    },
    {
      "id": "transzendenz/hua23/004",
      "locator": "husserliana-23-phantasie-bildbewusstsein-erinnerung-commentary#h3-s37-whether-perception-must-not-have-an-original-privilege-since-sensations-alon",
      "primary_locator": "Hua XXIII § 37",
      "stratum": "hua23-1904",
      "term": "transcendently perceived",
      "status": "presupposed",
      "claim": "Sensations are primarily apprehended as self-present, and on this are built the empirical apprehensions constituting what is transcendently perceived.",
      "quote": "They are primarily apprehended as self-present, and upon this are built the extending empirical apprehensions constituting what is transcendently perceived."
    },
    {
      "id": "transzendenz/hua23/005",
      "locator": "husserliana-23-phantasie-bildbewusstsein-erinnerung-commentary#h3-s42-circumscription-of-the-concept-of-simple-phantasy-presentation-as-enactment",
      "primary_locator": "Hua XXIII § 42",
      "stratum": "hua23-1904",
      "term": "immanent image-consciousness",
      "status": "revised",
      "claim": "The kinship of immanent, inward-turned image-consciousness with phantasy-consciousness is resolved: immanent image-consciousness is phantasy-consciousness.",
      "quote": "In fact, the consciousness is in essence the same on both sides: this immanent image-consciousness is phantasy-consciousness."
    }
  ],
  "absences": [
    {
      "locator": "husserliana-23-phantasie-bildbewusstsein-erinnerung-commentary#h3-s22-the-appearance-of-the-image-object-and-its-character-of-non-actuality-of-con",
      "expected_because": "The non-actuality of the image-object is the ground on which §16 separates immanent from symbolic imagehood.",
      "absent_terms": [
        "transcendence",
        "transcends",
        "immanence",
        "immanent"
      ]
    }
  ]
}
