{
  "schema_version": 1,
  "theme": "wesen",
  "commentary": "husserliana-28-vorlesungen-uber-ethik-und-wertlehre-commentary",
  "source_sha256": "fd9165d1171e8a6ec659a655447727e831a2aecb868d315e15f209b69ec5f379",
  "extracted_at": "2026-09-14",
  "extractor": {
    "agent": "claude-code",
    "prompt": "prompts/synthesis-pipeline/extraction-prompt.md",
    "note": "Whole file grep-scanned for the theme's search terms plus 'Wesensschau', 'eidetic', 'eidos', 'immutable', 'innate', 'Descartes', 'residuum' and 'free variation'. Closely read § 4(a) (lines 583-596), § 6(a) (649-662) and § 21 (499-512)."
  },
  "coverage": "partial",
  "coverage_note": "Covers § 4(a) (the science-theoretical character of the logical and noetic disciplines), § 6(a) (the principle-doctrines as clues for epistemological investigation) and § 21 (the convenience grounded in the essence of the will-act). Sections I-III and the remainder of the Formal Praktik were keyword-scanned only. The vocabulary here is 'essence-doctrine', 'essence-law' and 'essence-analysis' throughout; the eidetic terminology proper is absent from the file.",
  "units": [
    {
      "id": "wesen/hua28-ethik/001",
      "locator": "husserliana-28-vorlesungen-uber-ethik-und-wertlehre-commentary#h4-a-the-science-theoretical-character-of-the-logical-and-noetic-disciplines",
      "primary_locator": "Hua XXVIII § 4",
      "term": "essence-doctrine",
      "status": "introduced",
      "claim": "A priori philosophy is characterized as an a priori doctrine of principles, the pure essence-doctrine and norm-doctrine of absolute being thought in formal generality.",
      "quote": "an apriori philosophical doctrine of principles, the pure essence-doctrine and norm-doctrine of absolute being thought in formal generality"
    },
    {
      "id": "wesen/hua28-ethik/002",
      "locator": "husserliana-28-vorlesungen-uber-ethik-und-wertlehre-commentary#h4-a-the-science-theoretical-character-of-the-logical-and-noetic-disciplines",
      "primary_locator": "Hua XXVIII § 4",
      "term": "essence-laws",
      "status": "introduced",
      "claim": "No facts are in principle derivable from essence-laws, which prescribe to the facts only possibilities, in the manner of ideal norms.",
      "quote": "for from essence-laws no facts are in principle to be derived, the essence-laws prescribing to the facts only possibilities, in the manner of ideal norms."
    },
    {
      "id": "wesen/hua28-ethik/003",
      "locator": "husserliana-28-vorlesungen-uber-ethik-und-wertlehre-commentary#h4-a-the-science-theoretical-character-of-the-logical-and-noetic-disciplines",
      "primary_locator": "Hua XXVIII § 4",
      "term": "material apriori",
      "status": "introduced",
      "claim": "A material a priori, the essence-laws of colour and tone and the like, is said to fall outside the formal ontologies, so that the formal a priori does not exhaust the a priori.",
      "quote": "there is a *material* apriori (the essence-laws of color, tone, and the like) that falls outside the formal ontologies"
    },
    {
      "id": "wesen/hua28-ethik/004",
      "locator": "husserliana-28-vorlesungen-uber-ethik-und-wertlehre-commentary#h4-a-the-principle-doctrines-offer-the-clues-for-the-phenomenological-epistemologic",
      "primary_locator": "Hua XXVIII § 6",
      "term": "essence-relations",
      "status": "presupposed",
      "claim": "The phenomenological-reason-critical dimension is said to concern the puzzling essence-relations between being and consciousness.",
      "quote": "it concerns the puzzling essence-relations between being and consciousness"
    },
    {
      "id": "wesen/hua28-ethik/005",
      "locator": "husserliana-28-vorlesungen-uber-ethik-und-wertlehre-commentary#h3-s-21-the-objectivity-of-the-practical-possibilities-and-their-relativity-to-the",
      "primary_locator": "Hua XXVIII § 21",
      "term": "essence of the will-act",
      "status": "introduced",
      "claim": "Whether a will-act is convenient or not is said to be wholly determined by the own essence of the respective will-act.",
      "quote": "it is clear that by the own essence of the respective will-act it is wholly determined whether it is convenient or not"
    },
    {
      "id": "wesen/hua28-ethik/006",
      "locator": "husserliana-28-vorlesungen-uber-ethik-und-wertlehre-commentary#h3-s-21-the-objectivity-of-the-practical-possibilities-and-their-relativity-to-the",
      "primary_locator": "Hua XXVIII § 21",
      "term": "essence-analysis",
      "status": "introduced",
      "claim": "Judging insightfully about will-rightness in the objective attitude is described as performing an essence-analysis of the components that make up full rightness in the highest sense.",
      "quote": "performing an essence-analysis of the components that make up full rightness in the highest sense"
    }
  ],
  "absences": [
    {
      "locator": "husserliana-28-vorlesungen-uber-ethik-und-wertlehre-commentary#h4-a-the-science-theoretical-character-of-the-logical-and-noetic-disciplines",
      "expected_because": "This section lays out what an a priori essence-doctrine is and distinguishes formal from material essence-laws, so it is where the method by which essences are seen - and any comparison with a rationalist doctrine of innate or immutable natures - would be stated if the lectures stated it.",
      "absent_terms": ["Wesensschau", "eidetic", "eidos", "immutable", "innate", "Descartes", "residuum", "free variation"],
      "note": "The lectures secure essence-laws by insight and the parallel with pure logic, without any eidetic terminology and without naming Descartes anywhere in the file."
    }
  ]
}
